{
  "schema_version": "1.0",
  "registry_revision": "mac-ollama-1",
  "certification_state": "unverified",
  "source_pins": [
    {
      "id": "ollama-0.34.0-source",
      "role": "primary_current_semantic_source",
      "version": "0.34.0",
      "commit": "d8ab4b4f0ca24b51d3a46b3bf4f462e58ce66b1f",
      "execution": "source_inspection_only",
      "compatibility": "unverified_until_runtime_capture",
      "files": [
        {
          "path": "api/types.go",
          "sha256": "40c2647781a54fd3baedca021d495f3f7f899e217fce9697405e90b7930b9d8e"
        },
        {
          "path": "server/routes.go",
          "sha256": "99d48da007feaa85321ad24b25bff4d881c5bf329a5019aec642defe95396b73"
        }
      ]
    },
    {
      "id": "ollama-0.12.10-source",
      "role": "historical_observed_version_semantic_source",
      "version": "0.12.10",
      "commit": "80d34260ea16e76c9ef0d014a86cc130421855f1",
      "execution": "source_inspection_only",
      "compatibility": "unverified_observed_installation",
      "files": [
        {
          "path": "api/types.go",
          "sha256": "572ab419a1710d60604aa8a1585d4756ef07692dad6fd1b6365df4913ddd1f61"
        },
        {
          "path": "server/routes.go",
          "sha256": "6e39ff9a27c39d3b0f25f89e13f9ff024339fe7e76769881ce75b49b22630753"
        }
      ]
    },
    {
      "id": "xnu-11417.121.6-source",
      "role": "darwin_pressure_semantic_source",
      "version": "xnu-11417.121.6",
      "commit": "a1e26a70f38d1d7daa7b49b258e2f8538ad81650",
      "execution": "source_inspection_plus_observation_helper",
      "compatibility": "unverified_until_rmt_t16_t24",
      "files": [
        {
          "path": "bsd/kern/kern_memorystatus_notify.c",
          "sha256": "552451e0067fd7ee3b70242f53bc87b87566cfdca72f2c66d1f97895668f38e8"
        }
      ]
    }
  ],
  "metrics": [
    {
      "id": "host.cpu.busy_ratio",
      "unit": "ratio",
      "kind": "gauge",
      "value_contract": {
        "type": "number",
        "minimum": 0,
        "maximum": 1,
        "enum": null,
        "wire_encoding": "json_number"
      },
      "population": "host logical-core aggregate over collection interval",
      "source_method": "host_statistics HOST_CPU_LOAD_INFO aggregate busy tick delta divided by aggregate total tick delta; no additional logical-core division",
      "method_revision": "darwin-host-cpu-candidate-1",
      "support": "unverified",
      "quality": "measured",
      "zero_meaning": "idle interval",
      "missing_semantics": "omit_or_null_with_reason_never_zero_fill",
      "aggregation": "fresh compatible interval integration only",
      "labels": {
        "required": [
          "host_id"
        ],
        "optional": []
      },
      "source_pin_id": null,
      "certification_gate": "exact_os_build_rmt_capture_t16_t24"
    },
    {
      "id": "host.memory.pressure_level",
      "unit": "state",
      "kind": "gauge",
      "value_contract": {
        "type": "enum",
        "minimum": null,
        "maximum": null,
        "enum": [
          "normal",
          "warning",
          "critical"
        ],
        "wire_encoding": "json_string"
      },
      "population": "host at observation",
      "source_method": "sysctl kern.memorystatus_vm_pressure_level raw flags 1/2/4",
      "method_revision": "xnu-11417.121.6-pressure-flags",
      "support": "unverified",
      "quality": "measured",
      "zero_meaning": "not a numeric metric; raw zero is unavailable",
      "missing_semantics": "omit_or_null_with_reason_never_zero_fill",
      "aggregation": "consecutive fresh state dwell only",
      "labels": {
        "required": [
          "host_id"
        ],
        "optional": []
      },
      "source_pin_id": "xnu-11417.121.6-source",
      "certification_gate": "exact_os_build_rmt_capture_t16_t24"
    },
    {
      "id": "host.memory.compressed_bytes",
      "unit": "bytes",
      "kind": "gauge",
      "value_contract": {
        "type": "uint64",
        "minimum": 0,
        "maximum": null,
        "enum": null,
        "wire_encoding": "decimal_string"
      },
      "population": "host instantaneous",
      "source_method": "HOST_VM_INFO64 compressor_page_count times certified page size; physical compressor storage, not total_uncompressed_pages_in_compressor",
      "method_revision": "darwin-vm-candidate-1",
      "support": "unverified",
      "quality": "measured",
      "zero_meaning": "no compressed pages",
      "missing_semantics": "omit_or_null_with_reason_never_zero_fill",
      "aggregation": "fresh compatible interval integration and actual min/max",
      "labels": {
        "required": [
          "host_id"
        ],
        "optional": []
      },
      "source_pin_id": null,
      "certification_gate": "exact_os_build_rmt_capture_t16_t24"
    },
    {
      "id": "host.memory.swap_used_bytes",
      "unit": "bytes",
      "kind": "gauge",
      "value_contract": {
        "type": "uint64",
        "minimum": 0,
        "maximum": null,
        "enum": null,
        "wire_encoding": "decimal_string"
      },
      "population": "host instantaneous",
      "source_method": "sysctl vm.swapusage xsw_used",
      "method_revision": "darwin-swap-candidate-1",
      "support": "unverified",
      "quality": "measured",
      "zero_meaning": "no swap currently used",
      "missing_semantics": "omit_or_null_with_reason_never_zero_fill",
      "aggregation": "fresh compatible interval integration and actual min/max",
      "labels": {
        "required": [
          "host_id"
        ],
        "optional": []
      },
      "source_pin_id": null,
      "certification_gate": "exact_os_build_rmt_capture_t16_t24"
    },
    {
      "id": "host.disk.free_bytes",
      "unit": "bytes",
      "kind": "gauge",
      "value_contract": {
        "type": "uint64",
        "minimum": 0,
        "maximum": null,
        "enum": null,
        "wire_encoding": "decimal_string"
      },
      "population": "configured RMT local data volume instantaneous",
      "source_method": "statfs f_bavail times f_bsize with overflow check",
      "method_revision": "darwin-statfs-candidate-1",
      "support": "unverified",
      "quality": "measured",
      "zero_meaning": "configured volume full",
      "missing_semantics": "omit_or_null_with_reason_never_zero_fill",
      "aggregation": "fresh compatible interval integration and actual min/max",
      "labels": {
        "required": [
          "host_id"
        ],
        "optional": []
      },
      "source_pin_id": null,
      "certification_gate": "exact_os_build_rmt_capture_t16_t24"
    },
    {
      "id": "host.network.received_bytes_total",
      "unit": "bytes",
      "kind": "cumulative_counter",
      "value_contract": {
        "type": "uint64",
        "minimum": 0,
        "maximum": null,
        "enum": null,
        "wire_encoding": "decimal_string"
      },
      "population": "host admitted interface plus boot and counter epoch",
      "source_method": "bounded NET_RT_IFLIST2 sysctl if_msghdr2.ifm_data64.ifi_ibytes uint64",
      "method_revision": "darwin-net-rt-iflist2-ifdata64-candidate-1",
      "support": "unverified",
      "quality": "measured",
      "zero_meaning": "no admitted received bytes in epoch",
      "missing_semantics": "omit_or_null_with_reason_never_zero_fill",
      "aggregation": "delta only within identical boot interface and counter epoch",
      "labels": {
        "required": [
          "host_id",
          "interface_id",
          "boot_id",
          "counter_epoch_id"
        ],
        "optional": [
          "loopback"
        ]
      },
      "source_pin_id": null,
      "certification_gate": "exact_os_build_rmt_capture_t16_t24"
    },
    {
      "id": "host.network.sent_bytes_total",
      "unit": "bytes",
      "kind": "cumulative_counter",
      "value_contract": {
        "type": "uint64",
        "minimum": 0,
        "maximum": null,
        "enum": null,
        "wire_encoding": "decimal_string"
      },
      "population": "host admitted interface plus boot and counter epoch",
      "source_method": "bounded NET_RT_IFLIST2 sysctl if_msghdr2.ifm_data64.ifi_obytes uint64",
      "method_revision": "darwin-net-rt-iflist2-ifdata64-candidate-1",
      "support": "unverified",
      "quality": "measured",
      "zero_meaning": "no admitted sent bytes in epoch",
      "missing_semantics": "omit_or_null_with_reason_never_zero_fill",
      "aggregation": "delta only within identical boot interface and counter epoch",
      "labels": {
        "required": [
          "host_id",
          "interface_id",
          "boot_id",
          "counter_epoch_id"
        ],
        "optional": [
          "loopback"
        ]
      },
      "source_pin_id": null,
      "certification_gate": "exact_os_build_rmt_capture_t16_t24"
    },
    {
      "id": "process.cpu.busy_ratio",
      "unit": "ratio",
      "kind": "gauge",
      "value_contract": {
        "type": "number",
        "minimum": 0,
        "maximum": 1,
        "enum": null,
        "wire_encoding": "json_number"
      },
      "population": "bounded observable same-user process incarnation over interval",
      "source_method": "RUSAGE_INFO_V4 user plus system time deltas divided by elapsed and logical CPU count",
      "method_revision": "darwin-proc-rusage-candidate-1",
      "support": "unverified",
      "quality": "measured",
      "zero_meaning": "process idle during interval",
      "missing_semantics": "omit_or_null_with_reason_never_zero_fill",
      "aggregation": "per process-start identity; no causal attribution",
      "labels": {
        "required": [
          "host_id",
          "boot_id",
          "process_start_identity"
        ],
        "optional": [
          "target_id",
          "association_quality",
          "executable_basename"
        ]
      },
      "source_pin_id": null,
      "certification_gate": "exact_os_build_rmt_capture_t16_t24"
    },